{
  "$schema": "https://json-schema.org/draft/2020-12/schema",
  "$id": "https://sweepx.dev/schemas/sweepx.event/v1",
  "title": "SweepX Event Envelope v1",
  "type": "object",
  "additionalProperties": false,
  "required": [
    "schema",
    "streamId",
    "operationId",
    "sequence",
    "cursor",
    "emittedAt",
    "monotonicOffsetNs",
    "type",
    "phase",
    "payload",
    "terminal",
    "checkpoint"
  ],
  "properties": {
    "schema": {
      "const": "sweepx.event/v1"
    },
    "streamId": {
      "type": "string",
      "minLength": 1,
      "maxLength": 128,
      "pattern": "^[A-Za-z0-9][A-Za-z0-9._:-]*$"
    },
    "operationId": {
      "type": "string",
      "minLength": 1,
      "maxLength": 128,
      "pattern": "^[A-Za-z0-9][A-Za-z0-9._:-]*$"
    },
    "sequence": {
      "type": "string",
      "maxLength": 39,
      "pattern": "^[1-9][0-9]*$"
    },
    "cursor": {
      "type": "string",
      "minLength": 1,
      "maxLength": 1024,
      "pattern": "^[A-Za-z0-9._:-]+$",
      "$comment": "The envelope remains compatible with bounded legacy in-memory cursors. Durable stream validation additionally requires an opaque sxcur1 token."
    },
    "emittedAt": {
      "allOf": [
        {
          "$ref": "https://sweepx.dev/schemas/common/v1#/$defs/rfc3339Timestamp"
        },
        {
          "type": "string",
          "maxLength": 64,
          "pattern": "Z$"
        }
      ]
    },
    "monotonicOffsetNs": {
      "allOf": [
        {
          "$ref": "https://sweepx.dev/schemas/common/v1#/$defs/decimalString"
        },
        {
          "maxLength": 39
        }
      ]
    },
    "type": {
      "type": "string",
      "enum": [
        "operation.started",
        "phase.changed",
        "scan.root.admitted",
        "scan.progress",
        "scan.aggregate.revised",
        "scan.boundary.observed",
        "scan.error.observed",
        "scan.root.completed",
        "candidate.detected",
        "analysis.completed",
        "plan.created",
        "plan.rejected",
        "approval.requested",
        "approval.granted",
        "approval.rejected",
        "approval.expired",
        "authorization.explicit_dangerous_delete",
        "revalidation.started",
        "revalidation.passed",
        "revalidation.stale",
        "preflight.ready",
        "hard_protection.blocked",
        "operation.cancel.requested",
        "operation.cancel.accepted",
        "operation.cancel.already_requested",
        "operation.cancel.already_terminal",
        "operation.cancel.too_late",
        "action.intent.durable",
        "action.platform.completed",
        "action.skipped",
        "action.failed_before_submit",
        "action.permit.consumed",
        "action.reconciled",
        "action.indeterminate",
        "item.completed",
        "batch.completed",
        "batch.partial",
        "batch.cancelled",
        "batch.needs_reconciliation",
        "recovery.started",
        "recovery.completed",
        "audit.started",
        "audit.batch.committed",
        "audit.failed",
        "detail.persistence.failed",
        "stream.reset_required",
        "operation.terminal"
      ]
    },
    "phase": {
      "$ref": "https://sweepx.dev/schemas/common/v1#/$defs/eventPhase"
    },
    "payload": {
      "type": "object",
      "$comment": "Consumers additionally enforce a 262144-byte limit on compact JSON serialization."
    },
    "terminal": {
      "type": "boolean"
    },
    "checkpoint": {
      "type": "object",
      "additionalProperties": false,
      "required": [
        "durable",
        "lastDurableSequence"
      ],
      "properties": {
        "durable": {
          "type": "boolean"
        },
        "lastDurableSequence": {
          "allOf": [
            {
              "$ref": "https://sweepx.dev/schemas/common/v1#/$defs/decimalString"
            },
            {
              "maxLength": 39
            }
          ]
        }
      }
    }
  },
  "allOf": [
    {
      "if": {
        "properties": {
          "type": {
            "const": "operation.terminal"
          }
        },
        "required": [
          "type"
        ]
      },
      "then": {
        "properties": {
          "terminal": {
            "const": true
          }
        }
      },
      "else": {
        "properties": {
          "terminal": {
            "const": false
          }
        }
      }
    },
    {
      "if": {
        "properties": {
          "type": {
            "const": "operation.terminal"
          },
          "checkpoint": {
            "properties": {
              "durable": {
                "const": true
              }
            },
            "required": [
              "durable"
            ]
          }
        },
        "required": [
          "type",
          "checkpoint"
        ]
      },
      "then": {
        "properties": {
          "payload": {
            "$ref": "#/$defs/durableTerminalPayload"
          }
        }
      }
    },
    {
      "if": {
        "properties": {
          "type": {
            "const": "stream.reset_required"
          }
        },
        "required": [
          "type"
        ]
      },
      "then": {
        "properties": {
          "checkpoint": {
            "required": [
              "durable",
              "lastDurableSequence"
            ],
            "properties": {
              "durable": {
                "const": false
              },
              "lastDurableSequence": {
                "const": "0"
              }
            }
          },
          "payload": {
            "$ref": "#/$defs/streamResetRequiredPayload"
          }
        }
      }
    }
  ],
  "$defs": {
    "streamResetRequiredPayload": {
      "type": "object",
      "additionalProperties": false,
      "required": [
        "requestedCursor",
        "availableFromSequence",
        "snapshotRef",
        "resumeAfter"
      ],
      "properties": {
        "requestedCursor": {
          "type": "string",
          "maxLength": 1024,
          "pattern": "^sxcur1\\.[A-Za-z0-9_-]{16,}$"
        },
        "availableFromSequence": {
          "const": "1"
        },
        "snapshotRef": {
          "type": "object",
          "additionalProperties": false,
          "required": [
            "operationId"
          ],
          "properties": {
            "operationId": {
              "type": "string",
              "minLength": 1,
              "maxLength": 128,
              "pattern": "^[A-Za-z0-9][A-Za-z0-9._:-]*$"
            }
          }
        },
        "resumeAfter": {
          "type": "string",
          "maxLength": 1024,
          "pattern": "^sxcur1\\.[A-Za-z0-9_-]{16,}$"
        }
      }
    },
    "durableTerminalPayload": {
      "type": "object",
      "additionalProperties": false,
      "required": [
        "status",
        "exitCode",
        "kind",
        "snapshotDigest"
      ],
      "properties": {
        "status": {
          "$ref": "https://sweepx.dev/schemas/common/v1#/$defs/outputStatus"
        },
        "exitCode": {
          "type": "integer",
          "enum": [
            0,
            2,
            3,
            4,
            5,
            6,
            7,
            8,
            9,
            10,
            11,
            12,
            13
          ]
        },
        "kind": {
          "type": "string",
          "enum": [
            "scan.result",
            "explanation.result",
            "plan.result",
            "execution.result",
            "recovery.result",
            "cancel.result",
            "status.result",
            "capabilities.result",
            "cleaner.result",
            "audit.result",
            "cache.status.result"
          ]
        },
        "snapshotDigest": {
          "type": "string",
          "pattern": "^sha256:[0-9a-f]{64}$"
        }
      }
    }
  }
}
